{
  "sourceDisruptionId" : "urn:uuid:c69cb3e4-16ad-43c3-82b9-0deac75ecf9e",
  "affectedSitesSender" : [ "BPNS7588787849VQ" ],
  "resolvingMeasureDescription" : "We buffered the disruption period with safety stock. Alternative transports have been arranged to replenish the safety stocks.",
  "affectedSitesRecipient" : [ "BPNS6666787765VQ" ],
  "contentChangedAt" : "2023-12-13T15:00:00+01:00",
  "startDateOfEffect" : "2023-12-13T15:00:00+01:00",
  "relatedNotificationIds" : [ "urn:uuid:d05cef4a-b692-45bf-87cc-eda2d84e4c04" ],
  "materialsAffected" : [ {
    "materialGlobalAssetId" : "urn:uuid:48878d48-6f1d-47f5-8ded-a441d0d879df",
    "materialNumberCustomer" : "MNR-7307-AU340474.002",
    "materialNumberSupplier" : "MNR-8101-ID146955.001"
  } ],
  "leadingRootCause" : "strike",
  "effect" : "demand-reduction",
  "notificationId" : "urn:uuid:d9452f24-3bf3-4134-b3eb-68858f1b2362",
  "text" : "Capacity reduction due to ongoing strike.",
  "expectedEndDateOfEffect" : "2023-12-17T08:00:00+01:00",
  "status" : "resolved"
}